{"$schema":"https://json-schema.org/draft/2020-12/schema","type":"object","additionalProperties":false,"required":["schema_version","successor_contract_sha256","scope","primary_promotion_descriptor_sha256","output_root","tree_sha256","counts","members"],"properties":{"schema_version":{"const":"verified_multimodal_real_pilot_independent_visual_review_descriptor_v1.0.0"},"successor_contract_sha256":{"const":"b3b26b45e9508c5838f5045f6565b77201d19d14fba99c98f20c5ea147e113bf"},"scope":{"const":"immutable_independent_visual_review_no_external_claims"},"primary_promotion_descriptor_sha256":{"const":"8fe075ab8770891662b3b78045ea77d179455af893fdef5f68a28b4e6f2f075a"},"output_root":{"const":"data/mtl_archives/reports/verified_multimodal_batch_001_real_pilot/independent-review"},"tree_sha256":{"$ref":"#/$defs/hash"},"counts":{"type":"object","additionalProperties":false,"required":["files","bytes","reviewed","agreements","disagreements","verified_claims"],"properties":{"files":{"const":3},"bytes":{"type":"integer","minimum":1},"reviewed":{"const":16},"agreements":{"const":16},"disagreements":{"const":0},"verified_claims":{"const":0}}},"members":{"type":"array","minItems":3,"maxItems":3,"items":{"type":"object","additionalProperties":false,"required":["path","sha256","bytes"],"properties":{"path":{"enum":["independent-review-report-v1.json","independent-review-v1.jsonl","index.html"]},"sha256":{"$ref":"#/$defs/hash"},"bytes":{"type":"integer","minimum":1},"rows":{"const":16}}}}},"$defs":{"hash":{"type":"string","pattern":"^[a-f0-9]{64}$"}}}
